{
  "event_id": "018f4f70-8ab1-7cc4-a67d-fae57c0c0f10",
  "event_name": "vpv",
  "occurred_at": "2026-07-30T18:45:00.123Z",
  "received_at": "2026-07-30T18:45:00.240Z",
  "anonymous_id": "018f4f70-8ab1-7cc4-a67d-fae57c0c0f11",
  "session_id": "018f4f70-8ab1-7cc4-a67d-fae57c0c0f12",
  "properties": {
    "page_path": "/pricing"
  },
  "context": {
    "platform": "web",
    "sdk_version": "0.1.0"
  },
  "schema_version": "1.0.0",
  "tracking_plan_version": "1.0.0",
  "funnel_definition_version": "1.0.0",
  "consent": {
    "analytics": true
  },
  "event_time_quality": "client_verified"
}
